Color,Name,Description,combined_text,topic,Label,Categories_minor,Group,Merged_description
Color Turquoise | 8368/429,DOUBLE BREASTED JACQUARD BLAZER,Lapel collar jacket with long sleeves with pronounced shoulders. Front flap pockets. Front double-breasted closure with tonal lined buttons.,DOUBLE BREASTED JACQUARD BLAZER Lapel collar jacket with long sleeves with pronounced shoulders. Front flap pockets. Front double-breasted closure with tonal lined buttons.,10,1096,"Jackets,blazers",Non-Clothing,"DOUBLE BREASTED JACQUARD BLAZER Lapel collar jacket with long sleeves with pronounced shoulders. Front flap pockets. Front double-breasted closure with tonal lined buttons. Jackets,blazers"
Color Blue | 9065/307,TEXTURED CAP,Cap with visor. Matching tonal eyelet detail. Washed effect.Back fit adjustment.,TEXTURED CAP Cap with visor. Matching tonal eyelet detail. Washed effect.Back fit adjustment.,7,1097,"woolen articles,sweaters",Accessories,"TEXTURED CAP Cap with visor. Matching tonal eyelet detail. Washed effect.Back fit adjustment. woolen articles,sweaters"
Color Green | 1131/861,“BEL AIR” JOGGER PANTS,High-waisted pants with elastic waistband. Side pockets. Contrasting embroidered text detail at front. Elastic cuffs.,“BEL AIR” JOGGER PANTS High-waisted pants with elastic waistband. Side pockets. Contrasting embroidered text detail at front. Elastic cuffs.,0,1098,"casual pants,leggins,shorts",Bottomwear,"“BEL AIR” JOGGER PANTS High-waisted pants with elastic waistband. Side pockets. Contrasting embroidered text detail at front. Elastic cuffs. casual pants,leggins,shorts"
Color Blue | 8696/765,GRAFFITI T-SHIRT,Hoodie T-shirt with long sleeves.,GRAFFITI T-SHIRT Hoodie T-shirt with long sleeves.,6,1099,round-neck tshirt,Accessories,GRAFFITI T-SHIRT Hoodie T-shirt with long sleeves. round-neck tshirt
Color Green | 1105/452,TRAINING PANTS,"Training pants manufactured in technical stretch fabric.

- Elastic waistband with adjustable cord.
- Front pockets with concealed zippers. Back utility pocket.
- Reflective stripes at legs to increase visibility.
- Reflective logo at side.","TRAINING PANTS Training pants manufactured in technical stretch fabric.

- Elastic waistband with adjustable cord.
- Front pockets with concealed zippers. Back utility pocket.
- Reflective stripes at legs to increase visibility.
- Reflective logo at side.",0,1100,"casual pants,leggins,shorts",Bottomwear,"TRAINING PANTS Training pants manufactured in technical stretch fabric.

- Elastic waistband with adjustable cord.
- Front pockets with concealed zippers. Back utility pocket.
- Reflective stripes at legs to increase visibility.
- Reflective logo at side. casual pants,leggins,shorts"
Color various | 1202/303,2 PACK OF PLAIN BOXERS,Pack of two pairs of boxers with elastic waistband.,2 PACK OF PLAIN BOXERS Pack of two pairs of boxers with elastic waistband.,11,1101,accessories and combo packs,Non-Clothing,2 PACK OF PLAIN BOXERS Pack of two pairs of boxers with elastic waistband. accessories and combo packs
Color Multi-color | 2225/720,MULTI-COLOR RUNNING-STYLE SHOES,"Running-style shoes with a combination of colors and materials on the upper. Pull tab on the tongue for putting on with ease. Lacing with six pairs of eyelets. Thick soles with a combination of white, gray, and caramel outsoles.","MULTI-COLOR RUNNING-STYLE SHOES Running-style shoes with a combination of colors and materials on the upper. Pull tab on the tongue for putting on with ease. Lacing with six pairs of eyelets. Thick soles with a combination of white, gray, and caramel outsoles.",2,1102,Footwear,Upperwear,"MULTI-COLOR RUNNING-STYLE SHOES Running-style shoes with a combination of colors and materials on the upper. Pull tab on the tongue for putting on with ease. Lacing with six pairs of eyelets. Thick soles with a combination of white, gray, and caramel outsoles. Footwear"
Color Mauve | 1887/563,TEXT T-SHIRT,Round neck short sleeved T-shirt.,TEXT T-SHIRT Round neck short sleeved T-shirt.,6,1103,round-neck tshirt,Accessories,TEXT T-SHIRT Round neck short sleeved T-shirt. round-neck tshirt
Color White | 2969/311,FAUX LEATHER TOP,Faux leather top with high collar and long sleeves. Chest patch pocket.,FAUX LEATHER TOP Faux leather top with high collar and long sleeves. Chest patch pocket.,10,1104,"Jackets,blazers",Non-Clothing,"FAUX LEATHER TOP Faux leather top with high collar and long sleeves. Chest patch pocket. Jackets,blazers"
Color Green / Grass | 0264/806,STRAIGHT LEG PANTS,High-waisted pants with adjustable tied waistband. Hidden in-seam side pockets.,STRAIGHT LEG PANTS High-waisted pants with adjustable tied waistband. Hidden in-seam side pockets.,0,1105,"casual pants,leggins,shorts",Bottomwear,"STRAIGHT LEG PANTS High-waisted pants with adjustable tied waistband. Hidden in-seam side pockets. casual pants,leggins,shorts"
Color Oyster White | 0348/339,PATCHWORK SOCKS,Socks made of cotton blend yarn. Rib trim.,PATCHWORK SOCKS Socks made of cotton blend yarn. Rib trim.,11,1106,accessories and combo packs,Non-Clothing,PATCHWORK SOCKS Socks made of cotton blend yarn. Rib trim. accessories and combo packs
Color Blue / Steel | 8499/445,HIGH WAISTED STRAIGHT CUT PANTS,High-waisted pants with false back welt pockets. Side hidden in-seam zip closure.,HIGH WAISTED STRAIGHT CUT PANTS High-waisted pants with false back welt pockets. Side hidden in-seam zip closure.,0,1107,"casual pants,leggins,shorts",Bottomwear,"HIGH WAISTED STRAIGHT CUT PANTS High-waisted pants with false back welt pockets. Side hidden in-seam zip closure. casual pants,leggins,shorts"
Color Pastel pink | 9065/302,COMBINATION EMBROIDERED CAP,Cap with front embroidery detail. Back fit adjustment.,COMBINATION EMBROIDERED CAP Cap with front embroidery detail. Back fit adjustment.,7,1108,"woolen articles,sweaters",Accessories,"COMBINATION EMBROIDERED CAP Cap with front embroidery detail. Back fit adjustment. woolen articles,sweaters"
Color Light blue | 0371/704,CONTRASTING HEM SWEATSHIRT,Hooded sweatshirt with long cuffed sleeves. Combination hem with button closure.,CONTRASTING HEM SWEATSHIRT Hooded sweatshirt with long cuffed sleeves. Combination hem with button closure.,6,1109,round-neck tshirt,Accessories,CONTRASTING HEM SWEATSHIRT Hooded sweatshirt with long cuffed sleeves. Combination hem with button closure. round-neck tshirt
Color Bluish | 0061/537,TEXTURED FLORAL DRESS,Round neck textured dress with long sleeves. Buttoned back teardrop closure. Smocking detail at chest. All over contrast print.,TEXTURED FLORAL DRESS Round neck textured dress with long sleeves. Buttoned back teardrop closure. Smocking detail at chest. All over contrast print.,1,1110,"Dress,short skirt",Bottomwear,"TEXTURED FLORAL DRESS Round neck textured dress with long sleeves. Buttoned back teardrop closure. Smocking detail at chest. All over contrast print. Dress,short skirt"
Color Greens | 7943/653,STRIPED POPLIN SHIRT,Lapel collar shirt with cuffed long cuffed sleeves with dropped shoulders. Front patch pocket. Back pleat detail. Front button closure.,STRIPED POPLIN SHIRT Lapel collar shirt with cuffed long cuffed sleeves with dropped shoulders. Front patch pocket. Back pleat detail. Front button closure.,3,1111,Shirt,Upperwear,STRIPED POPLIN SHIRT Lapel collar shirt with cuffed long cuffed sleeves with dropped shoulders. Front patch pocket. Back pleat detail. Front button closure. Shirt
0110/339,SUBLIME EPOQUE EDP 80 ML,"ZARA SUBLIME EPOQUE EDP 80 ML (2.71 FL. OZ). 

Floral eau de parfum. Fragrance pyramid includes notes of orange blossom, tuberose and musk. A feminine, elegant, and delicate fragrance.","SUBLIME EPOQUE EDP 80 ML ZARA SUBLIME EPOQUE EDP 80 ML (2.71 FL. OZ). 

Floral eau de parfum. Fragrance pyramid includes notes of orange blossom, tuberose and musk. A feminine, elegant, and delicate fragrance.",13,1112,Fragrances,,"SUBLIME EPOQUE EDP 80 ML ZARA SUBLIME EPOQUE EDP 80 ML (2.71 FL. OZ). 

Floral eau de parfum. Fragrance pyramid includes notes of orange blossom, tuberose and musk. A feminine, elegant, and delicate fragrance. Fragrances"
Color Natural | 9249/099,WOODEN ORGANIZER BOX,Acacia wood organizer box.,WOODEN ORGANIZER BOX Acacia wood organizer box.,4,1113,non-clothing stuff,Accessories,WOODEN ORGANIZER BOX Acacia wood organizer box. non-clothing stuff
Color Black | 1736/214,STONE BUCKLE BELT,Wide belt with large metal buckle and multi-colored stones.,STONE BUCKLE BELT Wide belt with large metal buckle and multi-colored stones.,11,1114,accessories and combo packs,Non-Clothing,STONE BUCKLE BELT Wide belt with large metal buckle and multi-colored stones. accessories and combo packs
Color Ecru | 8501/441,SIX-PACK OF FLORAL PANTIES,Pack of six pairs of underwear with elastic waistband and bow appliqué. Gathered trim. Different prints.,SIX-PACK OF FLORAL PANTIES Pack of six pairs of underwear with elastic waistband and bow appliqué. Gathered trim. Different prints.,11,1115,accessories and combo packs,Non-Clothing,SIX-PACK OF FLORAL PANTIES Pack of six pairs of underwear with elastic waistband and bow appliqué. Gathered trim. Different prints. accessories and combo packs
Color GREEN | 1014/346,SEAMLESS TOP,"LIMITLESS CONTOUR COLLECTION
Crop top with straight neckline and spaghetti straps.","SEAMLESS TOP LIMITLESS CONTOUR COLLECTION
Crop top with straight neckline and spaghetti straps.",5,1116,"top,blouse,jumpsuit",Accessories,"SEAMLESS TOP LIMITLESS CONTOUR COLLECTION
Crop top with straight neckline and spaghetti straps. top,blouse,jumpsuit"
Color only one | 7960/895,TIE-DYE SHIRT,"Shirt with V-neck lapel collar, long sleeves, and buttoned vented cuffs. Asymmetric hem. Front button closure.","TIE-DYE SHIRT Shirt with V-neck lapel collar, long sleeves, and buttoned vented cuffs. Asymmetric hem. Front button closure.",3,1117,Shirt,Upperwear,"TIE-DYE SHIRT Shirt with V-neck lapel collar, long sleeves, and buttoned vented cuffs. Asymmetric hem. Front button closure. Shirt"
Color White | 4406/830,SNOOPY ® PEANUTS SNEAKERS,"Sneakers with Snoopy ® Peanuts detail on the side, tongue, and insole. Adjustable lace closure. Contrasting detail at back. Cotton lining and insole. 

STARFIT®. FLEXIBLE TECHNICAL SOLE MADE OF POLYURETHANE FOAM DESIGNED TO OFFER INCREASED COMFORT.","SNOOPY ® PEANUTS SNEAKERS Sneakers with Snoopy ® Peanuts detail on the side, tongue, and insole. Adjustable lace closure. Contrasting detail at back. Cotton lining and insole. 

STARFIT®. FLEXIBLE TECHNICAL SOLE MADE OF POLYURETHANE FOAM DESIGNED TO OFFER INCREASED COMFORT.",2,1118,Footwear,Upperwear,"SNOOPY ® PEANUTS SNEAKERS Sneakers with Snoopy ® Peanuts detail on the side, tongue, and insole. Adjustable lace closure. Contrasting detail at back. Cotton lining and insole. 

STARFIT®. FLEXIBLE TECHNICAL SOLE MADE OF POLYURETHANE FOAM DESIGNED TO OFFER INCREASED COMFORT. Footwear"
Color White | 6221/401,FLORAL PRINT TUMBLER,Glass tumbler with a floral print.,FLORAL PRINT TUMBLER Glass tumbler with a floral print.,4,1119,non-clothing stuff,Accessories,FLORAL PRINT TUMBLER Glass tumbler with a floral print. non-clothing stuff
Color Black | 9598/154,WOOL VEST,Round neck vest.,WOOL VEST Round neck vest.,7,1120,"woolen articles,sweaters",Accessories,"WOOL VEST Round neck vest. woolen articles,sweaters"
Color Pearl gray | 5671/051,FAUX FUR STAR-SHAPED THROW PILLOW,"Children&#39;s faux fur filled throw pillow. Featuring a design in the shape of a star with embroidered details.

","FAUX FUR STAR-SHAPED THROW PILLOW Children&#39;s faux fur filled throw pillow. Featuring a design in the shape of a star with embroidered details.

",8,1121,non clothing stuff,Non-Clothing,"FAUX FUR STAR-SHAPED THROW PILLOW Children&#39;s faux fur filled throw pillow. Featuring a design in the shape of a star with embroidered details.

 non clothing stuff"
Color Ecru/Yellow | 8019/455,SATIN EFFECT TIE-DYE SHIRT,V-neck shirt with lapel collar. Long sleeves with cuffs. Front patch pockets. Front metal button closure.,SATIN EFFECT TIE-DYE SHIRT V-neck shirt with lapel collar. Long sleeves with cuffs. Front patch pockets. Front metal button closure.,3,1122,Shirt,Upperwear,SATIN EFFECT TIE-DYE SHIRT V-neck shirt with lapel collar. Long sleeves with cuffs. Front patch pockets. Front metal button closure. Shirt
Color Multi-color | 3808/610,SLIDE SANDALS WITH COLORFUL FRINGES,"Multicolor slide sandals. Colorful fringe upper with metal details.

Sole height: 0.5 inches (1.3 cm)","SLIDE SANDALS WITH COLORFUL FRINGES Multicolor slide sandals. Colorful fringe upper with metal details.

Sole height: 0.5 inches (1.3 cm)",2,1123,Footwear,Upperwear,"SLIDE SANDALS WITH COLORFUL FRINGES Multicolor slide sandals. Colorful fringe upper with metal details.

Sole height: 0.5 inches (1.3 cm) Footwear"
Color Ecru | 1478/226,BUTTONED PANTS,High-waisted pants with front pockets and false welt pocket. Straight leg. Front false buttons.,BUTTONED PANTS High-waisted pants with front pockets and false welt pocket. Straight leg. Front false buttons.,0,1124,"casual pants,leggins,shorts",Bottomwear,"BUTTONED PANTS High-waisted pants with front pockets and false welt pocket. Straight leg. Front false buttons. casual pants,leggins,shorts"
Color Ecru | 3057/569,TEXTURED SHIRT,Shirt made of knit look fabric. Spread collar and short sleeves. Front button closure.,TEXTURED SHIRT Shirt made of knit look fabric. Spread collar and short sleeves. Front button closure.,3,1125,Shirt,Upperwear,TEXTURED SHIRT Shirt made of knit look fabric. Spread collar and short sleeves. Front button closure. Shirt
0120/155,PINK FLAMBÉ WINTER 100 ML,"ZARA PINK FLAMBÉ WINTER EDT 100 ML (3.4 FL. OZ). 

Asian-inspired eau de toilette. Fragrance pyramid includes notes of pear, violet and praline. A fresh, cozy and feminine fragrance.","PINK FLAMBÉ WINTER 100 ML ZARA PINK FLAMBÉ WINTER EDT 100 ML (3.4 FL. OZ). 

Asian-inspired eau de toilette. Fragrance pyramid includes notes of pear, violet and praline. A fresh, cozy and feminine fragrance.",13,1126,Fragrances,,"PINK FLAMBÉ WINTER 100 ML ZARA PINK FLAMBÉ WINTER EDT 100 ML (3.4 FL. OZ). 

Asian-inspired eau de toilette. Fragrance pyramid includes notes of pear, violet and praline. A fresh, cozy and feminine fragrance. Fragrances"
Color Khaki Green | 3222/820,FABRIC EXPLORER BACKPACK,"Khaki green backpack. Serged fabric exterior. Main compartment with adhesive strap, flap, and quick side release clip closure. Interior with two pockets, one for electronic devices and laptops up to 13 inches, and another mesh pocket with a zipper closure. Pocket at front, and side pockets with a snap button flap closure. Athletic straps on each pocket. Quilted back. One handle and two adjustable shoulder straps.

Height x Length x Width: 20.5 x 13.8 x 6.7 inches (52 x 35 x 17 cm)","FABRIC EXPLORER BACKPACK Khaki green backpack. Serged fabric exterior. Main compartment with adhesive strap, flap, and quick side release clip closure. Interior with two pockets, one for electronic devices and laptops up to 13 inches, and another mesh pocket with a zipper closure. Pocket at front, and side pockets with a snap button flap closure. Athletic straps on each pocket. Quilted back. One handle and two adjustable shoulder straps.

Height x Length x Width: 20.5 x 13.8 x 6.7 inches (52 x 35 x 17 cm)",9,1127,bags,Non-Clothing,"FABRIC EXPLORER BACKPACK Khaki green backpack. Serged fabric exterior. Main compartment with adhesive strap, flap, and quick side release clip closure. Interior with two pockets, one for electronic devices and laptops up to 13 inches, and another mesh pocket with a zipper closure. Pocket at front, and side pockets with a snap button flap closure. Athletic straps on each pocket. Quilted back. One handle and two adjustable shoulder straps.

Height x Length x Width: 20.5 x 13.8 x 6.7 inches (52 x 35 x 17 cm) bags"
Color Black | 3923/820,CARABINER KEYCHAIN STRAP,"CARABINER KEYCHAIN WITH TWO STRAPS. AVAILABLE IN DIFFERENT COLORS. HAS TWO RINGS TO ORGANIZE KEYS. 

Length 7.1 inches (18 cm)","CARABINER KEYCHAIN STRAP CARABINER KEYCHAIN WITH TWO STRAPS. AVAILABLE IN DIFFERENT COLORS. HAS TWO RINGS TO ORGANIZE KEYS. 

Length 7.1 inches (18 cm)",9,1128,bags,Non-Clothing,"CARABINER KEYCHAIN STRAP CARABINER KEYCHAIN WITH TWO STRAPS. AVAILABLE IN DIFFERENT COLORS. HAS TWO RINGS TO ORGANIZE KEYS. 

Length 7.1 inches (18 cm) bags"
Color Black | 5875/305,FRINGED SCARF,"Spun viscose blend lightweight scarf. Fringe trim.

DIMENSIONS: 74.8 x 27.6 inches (190 x 70 cm)","FRINGED SCARF Spun viscose blend lightweight scarf. Fringe trim.

DIMENSIONS: 74.8 x 27.6 inches (190 x 70 cm)",8,1129,non clothing stuff,Non-Clothing,"FRINGED SCARF Spun viscose blend lightweight scarf. Fringe trim.

DIMENSIONS: 74.8 x 27.6 inches (190 x 70 cm) non clothing stuff"
Color Greens | 7385/273,DRAPED TULLE MIDI SKIRT,High-waisted midi skirt with elastic waistband. Draped fabric. Interior lining.,DRAPED TULLE MIDI SKIRT High-waisted midi skirt with elastic waistband. Draped fabric. Interior lining.,1,1130,"Dress,short skirt",Bottomwear,"DRAPED TULLE MIDI SKIRT High-waisted midi skirt with elastic waistband. Draped fabric. Interior lining. Dress,short skirt"
Color only one | 5755/109,STRIPED KNIT SWEATER,Sweater made of a wool and alpaca blend. Round neck and long sleeves.,STRIPED KNIT SWEATER Sweater made of a wool and alpaca blend. Round neck and long sleeves.,7,1131,"woolen articles,sweaters",Accessories,"STRIPED KNIT SWEATER Sweater made of a wool and alpaca blend. Round neck and long sleeves. woolen articles,sweaters"
Color Ecru / Beige | 8514/052,STRIPED BOW BLOUSE,Blouse with lapel collar and long sleeves. Tied asymmetric hem. Front button closure.,STRIPED BOW BLOUSE Blouse with lapel collar and long sleeves. Tied asymmetric hem. Front button closure.,5,1132,"top,blouse,jumpsuit",Accessories,"STRIPED BOW BLOUSE Blouse with lapel collar and long sleeves. Tied asymmetric hem. Front button closure. top,blouse,jumpsuit"
Color Black | 6147/169,Z1975 FLARED JEWEL BUTTON JEANS,High-waisted jeans with front and back patch pockets. Flared legs. Front zip and metal button closure.,Z1975 FLARED JEWEL BUTTON JEANS High-waisted jeans with front and back patch pockets. Flared legs. Front zip and metal button closure.,12,1133,Jeans,Non-Clothing,Z1975 FLARED JEWEL BUTTON JEANS High-waisted jeans with front and back patch pockets. Flared legs. Front zip and metal button closure. Jeans
Color Black | 6889/710,NYLON PET CARRIER,"Pet carrier with nylon exterior. Exterior pockets and side mesh opening for better ventilation. Lined interior with removable protector. Adjustable and removable crossbody strap and shoulder straps. Zip closure. Recommended for pets up to 8.8 lbs (4 kg).

Height x Length x Width: 11.6 x 17 x 7.7 inches (29.5 x 44 x 19.5 cm)","NYLON PET CARRIER Pet carrier with nylon exterior. Exterior pockets and side mesh opening for better ventilation. Lined interior with removable protector. Adjustable and removable crossbody strap and shoulder straps. Zip closure. Recommended for pets up to 8.8 lbs (4 kg).

Height x Length x Width: 11.6 x 17 x 7.7 inches (29.5 x 44 x 19.5 cm)",9,1134,bags,Non-Clothing,"NYLON PET CARRIER Pet carrier with nylon exterior. Exterior pockets and side mesh opening for better ventilation. Lined interior with removable protector. Adjustable and removable crossbody strap and shoulder straps. Zip closure. Recommended for pets up to 8.8 lbs (4 kg).

Height x Length x Width: 11.6 x 17 x 7.7 inches (29.5 x 44 x 19.5 cm) bags"
Color Mauve | 5854/724,FLEECE SNAPS OVERSHIRT,Long sleeved overshirt with lapel collar. Front snap button closure. Patch pockets at front with flap.,FLEECE SNAPS OVERSHIRT Long sleeved overshirt with lapel collar. Front snap button closure. Patch pockets at front with flap.,3,1135,Shirt,Upperwear,FLEECE SNAPS OVERSHIRT Long sleeved overshirt with lapel collar. Front snap button closure. Patch pockets at front with flap. Shirt
Color taupe brown | 8501/518,FIVE-PACK OF TOAST COLORED BODYSUITS,Pack of five round neck long-sleeved bodysuits. Bottom snap button closure.,FIVE-PACK OF TOAST COLORED BODYSUITS Pack of five round neck long-sleeved bodysuits. Bottom snap button closure.,11,1136,accessories and combo packs,Non-Clothing,FIVE-PACK OF TOAST COLORED BODYSUITS Pack of five round neck long-sleeved bodysuits. Bottom snap button closure. accessories and combo packs
Color Beige | 2761/256,STRAIGHT CUT DOUBLE BREASTED BLAZER,Blazer with lapel collar and long sleeves. Front flap pockets and welt pocket at chest. Interior lining. Front double breasted button closure.,STRAIGHT CUT DOUBLE BREASTED BLAZER Blazer with lapel collar and long sleeves. Front flap pockets and welt pocket at chest. Interior lining. Front double breasted button closure.,10,1137,"Jackets,blazers",Non-Clothing,"STRAIGHT CUT DOUBLE BREASTED BLAZER Blazer with lapel collar and long sleeves. Front flap pockets and welt pocket at chest. Interior lining. Front double breasted button closure. Jackets,blazers"
7915/494,PRINTED HALTER DRESS,Ruched halter neck dress with wide cross-back straps. Self-belt with knot. Elastic at back.,PRINTED HALTER DRESS Ruched halter neck dress with wide cross-back straps. Self-belt with knot. Elastic at back.,1,1138,"Dress,short skirt",Bottomwear,"PRINTED HALTER DRESS Ruched halter neck dress with wide cross-back straps. Self-belt with knot. Elastic at back. Dress,short skirt"
8212/041,COFFEE GRINDER,"Glass and stainless steel coffee grinder. The thread is watertight, so you can also store the coffee inside. It grinds with medium intensity and the handle unscrews for easy storage or washing.","COFFEE GRINDER Glass and stainless steel coffee grinder. The thread is watertight, so you can also store the coffee inside. It grinds with medium intensity and the handle unscrews for easy storage or washing.",4,1139,non-clothing stuff,Accessories,"COFFEE GRINDER Glass and stainless steel coffee grinder. The thread is watertight, so you can also store the coffee inside. It grinds with medium intensity and the handle unscrews for easy storage or washing. non-clothing stuff"
Color Brown | 2313/810,LEATHER SANDALS WITH METALLIC HEEL,"Leather sandals with wide metallic heel. Thin front strap. Squared heel and toe. Buckled ankle strap closure. 

AIRFIT®. Technical flexible latex foam insole designed to offer increased comfort.

Heel height: 2.1 inches (5.3 cm)","LEATHER SANDALS WITH METALLIC HEEL Leather sandals with wide metallic heel. Thin front strap. Squared heel and toe. Buckled ankle strap closure. 

AIRFIT®. Technical flexible latex foam insole designed to offer increased comfort.

Heel height: 2.1 inches (5.3 cm)",2,1140,Footwear,Upperwear,"LEATHER SANDALS WITH METALLIC HEEL Leather sandals with wide metallic heel. Thin front strap. Squared heel and toe. Buckled ankle strap closure. 

AIRFIT®. Technical flexible latex foam insole designed to offer increased comfort.

Heel height: 2.1 inches (5.3 cm) Footwear"
9017/409,WAVY-DESIGN BOHEMIA CRYSTAL WINE GLASS,"Bohemia Crystal wine glass with a raised wavy design on the sides.

Bohemia Crystal glass is recognizable for its extreme transparency, shine and durability.","WAVY-DESIGN BOHEMIA CRYSTAL WINE GLASS Bohemia Crystal wine glass with a raised wavy design on the sides.

Bohemia Crystal glass is recognizable for its extreme transparency, shine and durability.",4,1141,non-clothing stuff,Accessories,"WAVY-DESIGN BOHEMIA CRYSTAL WINE GLASS Bohemia Crystal wine glass with a raised wavy design on the sides.

Bohemia Crystal glass is recognizable for its extreme transparency, shine and durability. non-clothing stuff"
