Color,Name,Description,combined_text,topic,Label,Categories_minor,Group,Merged_description
Color Blue | 5431/603,TIE-DYE RIB LEGGINGS,Ribbed leggings with elastic waistband and tie dye print.,TIE-DYE RIB LEGGINGS Ribbed leggings with elastic waistband and tie dye print.,0,355,"casual pants,leggins,shorts",Bottomwear,"TIE-DYE RIB LEGGINGS Ribbed leggings with elastic waistband and tie dye print. casual pants,leggins,shorts"
Color Navy blue | 7347/384,KNIT TIE,Tie made of cotton fabric.,KNIT TIE Tie made of cotton fabric.,3,356,Shirt,Upperwear,KNIT TIE Tie made of cotton fabric. Shirt
Color Bluish | 7284/021,PLAID LINEN TABLECLOTH,Linen tablecloth with a plaid print.,PLAID LINEN TABLECLOTH Linen tablecloth with a plaid print.,8,357,non clothing stuff,Non-Clothing,PLAID LINEN TABLECLOTH Linen tablecloth with a plaid print. non clothing stuff
Color Blue | 6688/224,WIDE LEG JEANS,"HI RISE - WIDE LEG - FULL LENGTH

High waist five pocket jeans in rigid fabric. Extra long wide legs with unfinished hems. Zip and metal button closure.","WIDE LEG JEANS HI RISE - WIDE LEG - FULL LENGTH

High waist five pocket jeans in rigid fabric. Extra long wide legs with unfinished hems. Zip and metal button closure.",12,358,Jeans,Non-Clothing,"WIDE LEG JEANS HI RISE - WIDE LEG - FULL LENGTH

High waist five pocket jeans in rigid fabric. Extra long wide legs with unfinished hems. Zip and metal button closure. Jeans"
Color Light blue | 5252/280,DENIM PINAFORE DRESS,Short overall dress with round neckline and adjustable straps. Front patch pocket. Side zip closure.,DENIM PINAFORE DRESS Short overall dress with round neckline and adjustable straps. Front patch pocket. Side zip closure.,1,359,"Dress,short skirt",Bottomwear,"DENIM PINAFORE DRESS Short overall dress with round neckline and adjustable straps. Front patch pocket. Side zip closure. Dress,short skirt"
0120/499,DEEP GARDEN 30 ML,"ZARA DEEP GARDEN EDP 30 ML (1.0 FL. OZ) Eau de parfum. Fragrance pyramid includes notes of pear, tuberose and tonka bean. A fresh, bright and feminine fragrance.","DEEP GARDEN 30 ML ZARA DEEP GARDEN EDP 30 ML (1.0 FL. OZ) Eau de parfum. Fragrance pyramid includes notes of pear, tuberose and tonka bean. A fresh, bright and feminine fragrance.",13,360,Fragrances,,"DEEP GARDEN 30 ML ZARA DEEP GARDEN EDP 30 ML (1.0 FL. OZ) Eau de parfum. Fragrance pyramid includes notes of pear, tuberose and tonka bean. A fresh, bright and feminine fragrance. Fragrances"
Color Dark anthracite | 6224/559,WAFFLE WEAVE JOGGING SUIT,Two-piece set. T-shirt with round neck and long sleeves. Front pouch pocket. Leggings with elastic waistband. Topstitching detail.,WAFFLE WEAVE JOGGING SUIT Two-piece set. T-shirt with round neck and long sleeves. Front pouch pocket. Leggings with elastic waistband. Topstitching detail.,6,361,round-neck tshirt,Accessories,WAFFLE WEAVE JOGGING SUIT Two-piece set. T-shirt with round neck and long sleeves. Front pouch pocket. Leggings with elastic waistband. Topstitching detail. round-neck tshirt
Color Coral pink | 2674/700,TEXTURED SPORTY JUMPSUIT LIMITED EDITION,Round neck sleeveless jumpsuit. Front snap button closure and elastic detail at drawstring waist.,TEXTURED SPORTY JUMPSUIT LIMITED EDITION Round neck sleeveless jumpsuit. Front snap button closure and elastic detail at drawstring waist.,5,362,"top,blouse,jumpsuit",Accessories,"TEXTURED SPORTY JUMPSUIT LIMITED EDITION Round neck sleeveless jumpsuit. Front snap button closure and elastic detail at drawstring waist. top,blouse,jumpsuit"
Color Mustard | 8369/008,PRINTED THROW PILLOW COVER,"Cotton throw pillow cover with a damask print in shades of camel.

Pillow insert not included.

","PRINTED THROW PILLOW COVER Cotton throw pillow cover with a damask print in shades of camel.

Pillow insert not included.

",8,363,non clothing stuff,Non-Clothing,"PRINTED THROW PILLOW COVER Cotton throw pillow cover with a damask print in shades of camel.

Pillow insert not included.

 non clothing stuff"
Color GREEN | 1014/347,SEAMLESS LEGGINGS,"LIMITLESS CONTOUR COLLECTION
High-waisted leggings.","SEAMLESS LEGGINGS LIMITLESS CONTOUR COLLECTION
High-waisted leggings.",0,364,"casual pants,leggins,shorts",Bottomwear,"SEAMLESS LEGGINGS LIMITLESS CONTOUR COLLECTION
High-waisted leggings. casual pants,leggins,shorts"
Color Multi-color | 1159/810,FABRIC HEELED ANKLE BOOTS,"Ankle boots with kitten heels. Sock style with geometric print fabric. Rubber soles. Pointed toes. 

AIRFIT®. Technical flexible latex foam insole designed to offer increased comfort.

Heel height: 1.6 inches (4.2 cm)","FABRIC HEELED ANKLE BOOTS Ankle boots with kitten heels. Sock style with geometric print fabric. Rubber soles. Pointed toes. 

AIRFIT®. Technical flexible latex foam insole designed to offer increased comfort.

Heel height: 1.6 inches (4.2 cm)",2,365,Footwear,Upperwear,"FABRIC HEELED ANKLE BOOTS Ankle boots with kitten heels. Sock style with geometric print fabric. Rubber soles. Pointed toes. 

AIRFIT®. Technical flexible latex foam insole designed to offer increased comfort.

Heel height: 1.6 inches (4.2 cm) Footwear"
Color Oyster White | 5643/529,POLKA-DOT TOP,Top with elasticized round neck and short sleeves.,POLKA-DOT TOP Top with elasticized round neck and short sleeves.,5,366,"top,blouse,jumpsuit",Accessories,"POLKA-DOT TOP Top with elasticized round neck and short sleeves. top,blouse,jumpsuit"
Color Red | 3843/810,STUDDED FLAT SANDALS,"Flat sandals with straps and stud detail. Squared toe.

AIRFIT®. Technical flexible latex foam insole designed to offer increased comfort.

Sole height: 0.2 inches (0.5 cm)","STUDDED FLAT SANDALS Flat sandals with straps and stud detail. Squared toe.

AIRFIT®. Technical flexible latex foam insole designed to offer increased comfort.

Sole height: 0.2 inches (0.5 cm)",2,367,Footwear,Upperwear,"STUDDED FLAT SANDALS Flat sandals with straps and stud detail. Squared toe.

AIRFIT®. Technical flexible latex foam insole designed to offer increased comfort.

Sole height: 0.2 inches (0.5 cm) Footwear"
0249/409,CRYSTALLINE RED WINE GLASS,"Wine glass made of crystalline. Sold individually.
Capacity: 29 oz","CRYSTALLINE RED WINE GLASS Wine glass made of crystalline. Sold individually.
Capacity: 29 oz",4,368,non-clothing stuff,Accessories,"CRYSTALLINE RED WINE GLASS Wine glass made of crystalline. Sold individually.
Capacity: 29 oz non-clothing stuff"
Color Light yellow | 1716/320,THREE-PACK OF PLAIN T-SHIRTS,"Pack of three plain round neck T-shirts with short sleeves.

Not sold separately. Returns must be of the entire pack.","THREE-PACK OF PLAIN T-SHIRTS Pack of three plain round neck T-shirts with short sleeves.

Not sold separately. Returns must be of the entire pack.",11,369,accessories and combo packs,Non-Clothing,"THREE-PACK OF PLAIN T-SHIRTS Pack of three plain round neck T-shirts with short sleeves.

Not sold separately. Returns must be of the entire pack. accessories and combo packs"
Color Mid-blue | 5767/522,GINGHAM JACQUARD DRESS,Straight neck dress with ruffled straps. Ruched detail.,GINGHAM JACQUARD DRESS Straight neck dress with ruffled straps. Ruched detail.,1,370,"Dress,short skirt",Bottomwear,"GINGHAM JACQUARD DRESS Straight neck dress with ruffled straps. Ruched detail. Dress,short skirt"
Color Ecru | 1123/301,BLOCK COLOR CORDUROY OVERSHIRT,Relaxed fit overshirt. Lapel collar and long sleeves with buttoned cuffs. Patch pockets with flaps at chest. Front button closure.,BLOCK COLOR CORDUROY OVERSHIRT Relaxed fit overshirt. Lapel collar and long sleeves with buttoned cuffs. Patch pockets with flaps at chest. Front button closure.,3,371,Shirt,Upperwear,BLOCK COLOR CORDUROY OVERSHIRT Relaxed fit overshirt. Lapel collar and long sleeves with buttoned cuffs. Patch pockets with flaps at chest. Front button closure. Shirt
Color Light blue | 4365/430,STRAIGHT FIT DENIM SHORTS,Shorts with five pockets. Washed effect. Front button closure.,STRAIGHT FIT DENIM SHORTS Shorts with five pockets. Washed effect. Front button closure.,12,372,Jeans,Non-Clothing,STRAIGHT FIT DENIM SHORTS Shorts with five pockets. Washed effect. Front button closure. Jeans
Color Gray marl | 5536/565,POLO COLLAR RIBBED KNIT SWEATER,Ribbed knit sweater with matching lapel collar and long sleeves. Button closure at yoke. Rib trim.,POLO COLLAR RIBBED KNIT SWEATER Ribbed knit sweater with matching lapel collar and long sleeves. Button closure at yoke. Rib trim.,3,373,Shirt,Upperwear,POLO COLLAR RIBBED KNIT SWEATER Ribbed knit sweater with matching lapel collar and long sleeves. Button closure at yoke. Rib trim. Shirt
Color Off White | 1010/800,Quilted slippers,Ecru quilted house slippers.,Quilted slippers Ecru quilted house slippers.,2,374,Footwear,Upperwear,Quilted slippers Ecru quilted house slippers. Footwear
Color Fuchsia | 6136/154,DRESS WITH SWISS EMBROIDERY,Straight neck dress with buttoned straps. Patch pocket at chest. Ruched detail. Embroidered eyelet motif.,DRESS WITH SWISS EMBROIDERY Straight neck dress with buttoned straps. Patch pocket at chest. Ruched detail. Embroidered eyelet motif.,1,375,"Dress,short skirt",Bottomwear,"DRESS WITH SWISS EMBROIDERY Straight neck dress with buttoned straps. Patch pocket at chest. Ruched detail. Embroidered eyelet motif. Dress,short skirt"
Color Red | 6285/026,VEGETABLE PRINT KITCHEN TOWEL,"Cotton kitchen towel with a vegetable print. Sold in packs of 2.

","VEGETABLE PRINT KITCHEN TOWEL Cotton kitchen towel with a vegetable print. Sold in packs of 2.

",8,376,non clothing stuff,Non-Clothing,"VEGETABLE PRINT KITCHEN TOWEL Cotton kitchen towel with a vegetable print. Sold in packs of 2.

 non clothing stuff"
 Pink | 1140/830,COOL CASE,"Fabric case with zip closure and pull tab. 

Height x Length x Width 3.7 x 7.5 x 2 inches (9.5 x 19 x 5 cm)","COOL CASE Fabric case with zip closure and pull tab. 

Height x Length x Width 3.7 x 7.5 x 2 inches (9.5 x 19 x 5 cm)",9,377,bags,Non-Clothing,"COOL CASE Fabric case with zip closure and pull tab. 

Height x Length x Width 3.7 x 7.5 x 2 inches (9.5 x 19 x 5 cm) bags"
Color Beige | 6033/810,BUCKLED MINI CROSSBODY BAG,"Crossbody bag with buckle detail. Lined interior with pocket. Removable chain crossbody strap. Magnetic closure. 

Height x Length x Width: 3.9 x 4.8 x 1.2 inches (10 x 12.2 x 3 cm)","BUCKLED MINI CROSSBODY BAG Crossbody bag with buckle detail. Lined interior with pocket. Removable chain crossbody strap. Magnetic closure. 

Height x Length x Width: 3.9 x 4.8 x 1.2 inches (10 x 12.2 x 3 cm)",9,378,bags,Non-Clothing,"BUCKLED MINI CROSSBODY BAG Crossbody bag with buckle detail. Lined interior with pocket. Removable chain crossbody strap. Magnetic closure. 

Height x Length x Width: 3.9 x 4.8 x 1.2 inches (10 x 12.2 x 3 cm) bags"
Color Sky blue | 0975/320,SEERSUCKER STRIPED SHIRT,Relaxed fit shirt with lapel collar and long sleeves with buttoned cuffs. Front button closure.,SEERSUCKER STRIPED SHIRT Relaxed fit shirt with lapel collar and long sleeves with buttoned cuffs. Front button closure.,3,379,Shirt,Upperwear,SEERSUCKER STRIPED SHIRT Relaxed fit shirt with lapel collar and long sleeves with buttoned cuffs. Front button closure. Shirt
Color Black | 3918/103,WATER REPELLENT PARKA,Full cut parka made of technical cotton blend fabric. High collar. Long sleeves with adjustable snap button cuffs. Flap pockets at hip. Interior pocket. Adjustable drawstring waist and hem. Front zip closure hidden by a snap button flap.,WATER REPELLENT PARKA Full cut parka made of technical cotton blend fabric. High collar. Long sleeves with adjustable snap button cuffs. Flap pockets at hip. Interior pocket. Adjustable drawstring waist and hem. Front zip closure hidden by a snap button flap.,14,380,Jacket,,WATER REPELLENT PARKA Full cut parka made of technical cotton blend fabric. High collar. Long sleeves with adjustable snap button cuffs. Flap pockets at hip. Interior pocket. Adjustable drawstring waist and hem. Front zip closure hidden by a snap button flap. Jacket
Color striped | 0975/300,STRIPED COTTON SHIRT,Regular fit shirt with Italian collar and long sleeves with buttoned cuffs. Front button closure.,STRIPED COTTON SHIRT Regular fit shirt with Italian collar and long sleeves with buttoned cuffs. Front button closure.,3,381,Shirt,Upperwear,STRIPED COTTON SHIRT Regular fit shirt with Italian collar and long sleeves with buttoned cuffs. Front button closure. Shirt
Color Black | 2024/820,LEATHER ANKLE BOOTS WITH POINTED TOE,BLACK LEATHER CHELSEA ANKLE BOOTS. SIDE ELASTIC GORING FOR AN EASIER FIT. SOLES WITH BLACK TOPSTITCHING AROUND THE EDGE. POINTED TOE.,LEATHER ANKLE BOOTS WITH POINTED TOE BLACK LEATHER CHELSEA ANKLE BOOTS. SIDE ELASTIC GORING FOR AN EASIER FIT. SOLES WITH BLACK TOPSTITCHING AROUND THE EDGE. POINTED TOE.,2,382,Footwear,Upperwear,LEATHER ANKLE BOOTS WITH POINTED TOE BLACK LEATHER CHELSEA ANKLE BOOTS. SIDE ELASTIC GORING FOR AN EASIER FIT. SOLES WITH BLACK TOPSTITCHING AROUND THE EDGE. POINTED TOE. Footwear
Color Black | 2298/180,RUFFLED EMBROIDERED BLOUSE,Round neck long sleeve blouse. Ruffles and embroidered eyelet details. Front closure with tonal lined buttons.,RUFFLED EMBROIDERED BLOUSE Round neck long sleeve blouse. Ruffles and embroidered eyelet details. Front closure with tonal lined buttons.,5,383,"top,blouse,jumpsuit",Accessories,"RUFFLED EMBROIDERED BLOUSE Round neck long sleeve blouse. Ruffles and embroidered eyelet details. Front closure with tonal lined buttons. top,blouse,jumpsuit"
Color Black | 0653/700,LOTTO BUCKET HAT,Bucket hat with contrast Lotto logo.,LOTTO BUCKET HAT Bucket hat with contrast Lotto logo.,7,384,"woolen articles,sweaters",Accessories,"LOTTO BUCKET HAT Bucket hat with contrast Lotto logo. woolen articles,sweaters"
Color Mid-pink | 8534/013,VELOUR-TEXTURE TOWEL,"Cotton jacquard towel with striped dyed thread and a velour finish. 470 GSM.

","VELOUR-TEXTURE TOWEL Cotton jacquard towel with striped dyed thread and a velour finish. 470 GSM.

",8,385,non clothing stuff,Non-Clothing,"VELOUR-TEXTURE TOWEL Cotton jacquard towel with striped dyed thread and a velour finish. 470 GSM.

 non clothing stuff"
Color Gray | 6299/210,BOROSILICATE GLASS MUG,Borosilicate glass mug.,BOROSILICATE GLASS MUG Borosilicate glass mug.,4,386,non-clothing stuff,Accessories,BOROSILICATE GLASS MUG Borosilicate glass mug. non-clothing stuff
Color Anthracite grey | 1554/584,BASIC LEOTARD,Plain tights with elastic waistband.,BASIC LEOTARD Plain tights with elastic waistband.,0,387,"casual pants,leggins,shorts",Bottomwear,"BASIC LEOTARD Plain tights with elastic waistband. casual pants,leggins,shorts"
Color Khaki | 7102/024,,Lapel collar overshirt with buttoned tab cuffed sleeves. Front patch pockets with flaps. Adjustable drawstring waist. Front snap button closure., Lapel collar overshirt with buttoned tab cuffed sleeves. Front patch pockets with flaps. Adjustable drawstring waist. Front snap button closure.,3,388,Shirt,Upperwear, Lapel collar overshirt with buttoned tab cuffed sleeves. Front patch pockets with flaps. Adjustable drawstring waist. Front snap button closure. Shirt
Color Light khaki | 4387/033,SATIN EFFECT OVERSIZED SHIRT,Flowy shirt with lapel collar and long sleeves. Front button closure.,SATIN EFFECT OVERSIZED SHIRT Flowy shirt with lapel collar and long sleeves. Front button closure.,3,389,Shirt,Upperwear,SATIN EFFECT OVERSIZED SHIRT Flowy shirt with lapel collar and long sleeves. Front button closure. Shirt
Color Black | 6840/247,ZW THE HIGH WAIST SHORTS,"Slim Fit - High Rise
ZW SIGNATURE DENIM

High-waisted five pocket shorts. Washed effect. Ripped detail. Frayed hem. Front zip and metal button closure.","ZW THE HIGH WAIST SHORTS Slim Fit - High Rise
ZW SIGNATURE DENIM

High-waisted five pocket shorts. Washed effect. Ripped detail. Frayed hem. Front zip and metal button closure.",12,390,Jeans,Non-Clothing,"ZW THE HIGH WAIST SHORTS Slim Fit - High Rise
ZW SIGNATURE DENIM

High-waisted five pocket shorts. Washed effect. Ripped detail. Frayed hem. Front zip and metal button closure. Jeans"
Color Brown | 2210/302,BOX 4 KNIVES WITH WOOD-EFFECT HANDLE,"Pack of 4 18/0 stainless steel table knives. Featuring a fine, wood-effect handle available in two colors: light brown and black.","BOX 4 KNIVES WITH WOOD-EFFECT HANDLE Pack of 4 18/0 stainless steel table knives. Featuring a fine, wood-effect handle available in two colors: light brown and black.",4,391,non-clothing stuff,Accessories,"BOX 4 KNIVES WITH WOOD-EFFECT HANDLE Pack of 4 18/0 stainless steel table knives. Featuring a fine, wood-effect handle available in two colors: light brown and black. non-clothing stuff"
Color Light blue | 4365/237,HIGH RISE STRAIGHT LEG JEANS,"HIGH RISE - STRAIGHT LEG - CROPPED

High waist five pocket jeans in rigid fabric. Front metal button closure.","HIGH RISE STRAIGHT LEG JEANS HIGH RISE - STRAIGHT LEG - CROPPED

High waist five pocket jeans in rigid fabric. Front metal button closure.",12,392,Jeans,Non-Clothing,"HIGH RISE STRAIGHT LEG JEANS HIGH RISE - STRAIGHT LEG - CROPPED

High waist five pocket jeans in rigid fabric. Front metal button closure. Jeans"
Color Bluish | 1930/433,RETRO JACQUARD PANTS,High-waisted pants with elastic waistband. Wide leg.,RETRO JACQUARD PANTS High-waisted pants with elastic waistband. Wide leg.,0,393,"casual pants,leggins,shorts",Bottomwear,"RETRO JACQUARD PANTS High-waisted pants with elastic waistband. Wide leg. casual pants,leggins,shorts"
Color Oyster White | 2658/701,SWISS DOT BLOUSE,Blouse with ruffled round neck and long sleeves. Buttoned teardrop closure at yoke. Dotted mesh detail.,SWISS DOT BLOUSE Blouse with ruffled round neck and long sleeves. Buttoned teardrop closure at yoke. Dotted mesh detail.,5,394,"top,blouse,jumpsuit",Accessories,"SWISS DOT BLOUSE Blouse with ruffled round neck and long sleeves. Buttoned teardrop closure at yoke. Dotted mesh detail. top,blouse,jumpsuit"
Color Oyster White | 2335/310,BASIC POCKET TANK TOP,Round neck T-shirt with short cuffed sleeves. Back button closure. Patch pocket at chest.,BASIC POCKET TANK TOP Round neck T-shirt with short cuffed sleeves. Back button closure. Patch pocket at chest.,6,395,round-neck tshirt,Accessories,BASIC POCKET TANK TOP Round neck T-shirt with short cuffed sleeves. Back button closure. Patch pocket at chest. round-neck tshirt
Color Dusty pink | 3590/015,ECOLOGICALLY GROWN COTTON BATH MAT,"Ecologically grown cotton bath mat. 
500 GSM

","ECOLOGICALLY GROWN COTTON BATH MAT Ecologically grown cotton bath mat. 
500 GSM

",8,396,non clothing stuff,Non-Clothing,"ECOLOGICALLY GROWN COTTON BATH MAT Ecologically grown cotton bath mat. 
500 GSM

 non clothing stuff"
Color Black | 5280/210,MATTE STONEWARE MUG,Stoneware cup or mug. Black monochrome design with a matte finish.,MATTE STONEWARE MUG Stoneware cup or mug. Black monochrome design with a matte finish.,4,397,non-clothing stuff,Accessories,MATTE STONEWARE MUG Stoneware cup or mug. Black monochrome design with a matte finish. non-clothing stuff
Color Purple | 7852/604,PRINTED LINEN BLEND PANTS,Pants made of linen blend fabric. High-waisted with belt loops. Side pockets and back patch pockets. Front zip and button closure.,PRINTED LINEN BLEND PANTS Pants made of linen blend fabric. High-waisted with belt loops. Side pockets and back patch pockets. Front zip and button closure.,0,398,"casual pants,leggins,shorts",Bottomwear,"PRINTED LINEN BLEND PANTS Pants made of linen blend fabric. High-waisted with belt loops. Side pockets and back patch pockets. Front zip and button closure. casual pants,leggins,shorts"
Color Natural | 7206/049,SQUARE WOVEN BASKET WITH HANDLES,Square woven seagrass basket with handles. Perfect as a decorative element or for storage.,SQUARE WOVEN BASKET WITH HANDLES Square woven seagrass basket with handles. Perfect as a decorative element or for storage.,4,399,non-clothing stuff,Accessories,SQUARE WOVEN BASKET WITH HANDLES Square woven seagrass basket with handles. Perfect as a decorative element or for storage. non-clothing stuff
Color Pink | 1278/730,TIE-DYE TOTE,"Tie dye shopper. Shoulder straps.

Height x Length: 15.7 x 22.8 inches (40 x 58 cm)","TIE-DYE TOTE Tie dye shopper. Shoulder straps.

Height x Length: 15.7 x 22.8 inches (40 x 58 cm)",9,400,bags,Non-Clothing,"TIE-DYE TOTE Tie dye shopper. Shoulder straps.

Height x Length: 15.7 x 22.8 inches (40 x 58 cm) bags"
Color Light green | 6295/207,RAISED-DESIGN TEACUP AND SAUCER,Glass teacup and saucer with a raised design.,RAISED-DESIGN TEACUP AND SAUCER Glass teacup and saucer with a raised design.,4,401,non-clothing stuff,Accessories,RAISED-DESIGN TEACUP AND SAUCER Glass teacup and saucer with a raised design. non-clothing stuff
Color Navy blue | 0858/456,VOLUMINOUS SHORT DRESS,Short dress with round neck and short balloon sleeves. Tonal matching fabric detail. Ruffled hem.,VOLUMINOUS SHORT DRESS Short dress with round neck and short balloon sleeves. Tonal matching fabric detail. Ruffled hem.,1,402,"Dress,short skirt",Bottomwear,"VOLUMINOUS SHORT DRESS Short dress with round neck and short balloon sleeves. Tonal matching fabric detail. Ruffled hem. Dress,short skirt"
Color White | 0163/086,DOWN MATTRESS TOPPER,"Down and feather mattress cover. Achieve the hotel effect in your home by placing this topper over your mattress and under the fitted sheet. Provides firmness and a quilted feel that adapts to the curvature of your body. 

The filling is 10% down and 90% French white duck feathers, and the surface is made of 100% combed cotton percale, 230TC and downproof, allowing the down to breathe and preventing the filling from escaping. Super soft and high quality.

1.6"" high and includes two elastic bands for a secure fit and easy positioning.
Firmness: 1650 GSM
Do not air dry, tumble dry at a low temperature.","DOWN MATTRESS TOPPER Down and feather mattress cover. Achieve the hotel effect in your home by placing this topper over your mattress and under the fitted sheet. Provides firmness and a quilted feel that adapts to the curvature of your body. 

The filling is 10% down and 90% French white duck feathers, and the surface is made of 100% combed cotton percale, 230TC and downproof, allowing the down to breathe and preventing the filling from escaping. Super soft and high quality.

1.6"" high and includes two elastic bands for a secure fit and easy positioning.
Firmness: 1650 GSM
Do not air dry, tumble dry at a low temperature.",8,403,non clothing stuff,Non-Clothing,"DOWN MATTRESS TOPPER Down and feather mattress cover. Achieve the hotel effect in your home by placing this topper over your mattress and under the fitted sheet. Provides firmness and a quilted feel that adapts to the curvature of your body. 

The filling is 10% down and 90% French white duck feathers, and the surface is made of 100% combed cotton percale, 230TC and downproof, allowing the down to breathe and preventing the filling from escaping. Super soft and high quality.

1.6"" high and includes two elastic bands for a secure fit and easy positioning.
Firmness: 1650 GSM
Do not air dry, tumble dry at a low temperature. non clothing stuff"
Color Ecru / Green | 1248/412,COLORBLOCK SWEATSHIRT,"Roomy jacket made of fleece fabric. High collar with front zipper closure, long sleeves, and elastic cuffs. Front pouch pocket. Elastic hem.","COLORBLOCK SWEATSHIRT Roomy jacket made of fleece fabric. High collar with front zipper closure, long sleeves, and elastic cuffs. Front pouch pocket. Elastic hem.",7,404,"woolen articles,sweaters",Accessories,"COLORBLOCK SWEATSHIRT Roomy jacket made of fleece fabric. High collar with front zipper closure, long sleeves, and elastic cuffs. Front pouch pocket. Elastic hem. woolen articles,sweaters"
Color Mauve | 9598/161,RIBBED CROPPED KNIT SWEATER,V-neck sweater with long sleeves.,RIBBED CROPPED KNIT SWEATER V-neck sweater with long sleeves.,7,405,"woolen articles,sweaters",Accessories,"RIBBED CROPPED KNIT SWEATER V-neck sweater with long sleeves. woolen articles,sweaters"
Color Oyster White | 9621/420,COTTON SHORTS,Shorts made of stretch cotton. Front pockets and back welt pockets. Cuffed hem.,COTTON SHORTS Shorts made of stretch cotton. Front pockets and back welt pockets. Cuffed hem.,0,406,"casual pants,leggins,shorts",Bottomwear,"COTTON SHORTS Shorts made of stretch cotton. Front pockets and back welt pockets. Cuffed hem. casual pants,leggins,shorts"
Color Blue | 3284/320,PURL KNIT SWEATER,Roomy sweater with round neck and long sleeves. Rib trim.,PURL KNIT SWEATER Roomy sweater with round neck and long sleeves. Rib trim.,7,407,"woolen articles,sweaters",Accessories,"PURL KNIT SWEATER Roomy sweater with round neck and long sleeves. Rib trim. woolen articles,sweaters"
Color Black | 2313/820,MULTIPIECE RUNNING STYLE SHOES,RUNNING STYLE SNEAKERS AVAILABLE IN TWO COLORS. OVERLAPPING MATERIALS AT UPPER WITH DIFFERENT TEXTURES. LACING WITH FOUR PAIRS OF EYELETS. SOLE MADE UP OF VARIOUS PIECES WITH TREADED OUTSOLE.,MULTIPIECE RUNNING STYLE SHOES RUNNING STYLE SNEAKERS AVAILABLE IN TWO COLORS. OVERLAPPING MATERIALS AT UPPER WITH DIFFERENT TEXTURES. LACING WITH FOUR PAIRS OF EYELETS. SOLE MADE UP OF VARIOUS PIECES WITH TREADED OUTSOLE.,2,408,Footwear,Upperwear,MULTIPIECE RUNNING STYLE SHOES RUNNING STYLE SNEAKERS AVAILABLE IN TWO COLORS. OVERLAPPING MATERIALS AT UPPER WITH DIFFERENT TEXTURES. LACING WITH FOUR PAIRS OF EYELETS. SOLE MADE UP OF VARIOUS PIECES WITH TREADED OUTSOLE. Footwear
Color Mid-pink | 1971/176,TIED POPLIN BLOUSE,V-neck blouse with lapel and tie. Long sleeves.,TIED POPLIN BLOUSE V-neck blouse with lapel and tie. Long sleeves.,5,409,"top,blouse,jumpsuit",Accessories,"TIED POPLIN BLOUSE V-neck blouse with lapel and tie. Long sleeves. top,blouse,jumpsuit"
