Color,Name,Description,combined_text,topic,Label,Categories_minor,Group,Merged_description
Color White | 1355/046,CERAMIC VASE,Enameled ceramic vase. Can hold water. Each item is unique due to the production technique.,CERAMIC VASE Enameled ceramic vase. Can hold water. Each item is unique due to the production technique.,4,693,non-clothing stuff,Accessories,CERAMIC VASE Enameled ceramic vase. Can hold water. Each item is unique due to the production technique. non-clothing stuff
Color Brown / Taupe | 5647/724,(PACK OF 3) MUSLIN DOUBLE SIDED MINI TOWELS,"Pack of 3 mini towels made of a combination of fabrics: muslin and cotton terrycloth. Different design on each: solid color, polka dot and floral print.","(PACK OF 3) MUSLIN DOUBLE SIDED MINI TOWELS Pack of 3 mini towels made of a combination of fabrics: muslin and cotton terrycloth. Different design on each: solid color, polka dot and floral print.",8,694,non clothing stuff,Non-Clothing,"(PACK OF 3) MUSLIN DOUBLE SIDED MINI TOWELS Pack of 3 mini towels made of a combination of fabrics: muslin and cotton terrycloth. Different design on each: solid color, polka dot and floral print. non clothing stuff"
Color Multicolored | 1165/151,PRINTED HALTER NECK DRESS,Halter dress with elastic waistband. Ruffled hem.,PRINTED HALTER NECK DRESS Halter dress with elastic waistband. Ruffled hem.,1,695,"Dress,short skirt",Bottomwear,"PRINTED HALTER NECK DRESS Halter dress with elastic waistband. Ruffled hem. Dress,short skirt"
Color Blue | 6224/738,STRIPED T-SHIRT,T-shirt with round neck and long sleeves. Shoulder button closure. Striped print.,STRIPED T-SHIRT T-shirt with round neck and long sleeves. Shoulder button closure. Striped print.,3,696,Shirt,Upperwear,STRIPED T-SHIRT T-shirt with round neck and long sleeves. Shoulder button closure. Striped print. Shirt
Color taupe brown | 2209/566,PREMIUM SILK BLEND KNIT SOCKS,Long knit socks made with 12% mulberry silk fabric.,PREMIUM SILK BLEND KNIT SOCKS Long knit socks made with 12% mulberry silk fabric.,11,697,accessories and combo packs,Non-Clothing,PREMIUM SILK BLEND KNIT SOCKS Long knit socks made with 12% mulberry silk fabric. accessories and combo packs
Color Natural | 0485/538,COMBINATION LEAF PRINT DRESS,Combination dress with high collar and long sleeves with rib cuffs. Half zip closure.,COMBINATION LEAF PRINT DRESS Combination dress with high collar and long sleeves with rib cuffs. Half zip closure.,6,698,round-neck tshirt,Accessories,COMBINATION LEAF PRINT DRESS Combination dress with high collar and long sleeves with rib cuffs. Half zip closure. round-neck tshirt
Color Multi-color | 4200/930,CONTRASTING HIGH TOPS,High top sneakers in a combination of pieces. Adjustable laces and side zip closure. Back pull tab for ease. Memory foam effect cotton lining and insole. Rubber soles.,CONTRASTING HIGH TOPS High top sneakers in a combination of pieces. Adjustable laces and side zip closure. Back pull tab for ease. Memory foam effect cotton lining and insole. Rubber soles.,2,699,Footwear,Upperwear,CONTRASTING HIGH TOPS High top sneakers in a combination of pieces. Adjustable laces and side zip closure. Back pull tab for ease. Memory foam effect cotton lining and insole. Rubber soles. Footwear
Color Light green | 0206/213,MINI FLORAL DESIGN GLASS PITCHER,Glass pitcher with small floral raised design.,MINI FLORAL DESIGN GLASS PITCHER Glass pitcher with small floral raised design.,4,700,non-clothing stuff,Accessories,MINI FLORAL DESIGN GLASS PITCHER Glass pitcher with small floral raised design. non-clothing stuff
Color Golden | 4340/203,PACK OF PAINTED BEAD EARRINGS,"Pack of two pairs of open hoop earrings:

-Metal hoop earrings with painted beads. Snap closure.
Metal hoop earrings. Snap closure.","PACK OF PAINTED BEAD EARRINGS Pack of two pairs of open hoop earrings:

-Metal hoop earrings with painted beads. Snap closure.
Metal hoop earrings. Snap closure.",11,701,accessories and combo packs,Non-Clothing,"PACK OF PAINTED BEAD EARRINGS Pack of two pairs of open hoop earrings:

-Metal hoop earrings with painted beads. Snap closure.
Metal hoop earrings. Snap closure. accessories and combo packs"
Color Navy blue | 2666/750,LIGHTWEIGHT PUFFER JACKET,Lightly padded jacket with high collar and long sleeves. Recessed front zip closure. Front pockets with hidden zip closure.,LIGHTWEIGHT PUFFER JACKET Lightly padded jacket with high collar and long sleeves. Recessed front zip closure. Front pockets with hidden zip closure.,14,702,Jacket,,LIGHTWEIGHT PUFFER JACKET Lightly padded jacket with high collar and long sleeves. Recessed front zip closure. Front pockets with hidden zip closure. Jacket
Color Ecru | 1887/311,PETER PAN COLLAR SHIRT,Peter pan collar shirt with long sleeves. Back button teardrop closure.,PETER PAN COLLAR SHIRT Peter pan collar shirt with long sleeves. Back button teardrop closure.,3,703,Shirt,Upperwear,PETER PAN COLLAR SHIRT Peter pan collar shirt with long sleeves. Back button teardrop closure. Shirt
Color Black | 0962/653,RIBBED POLO,Polo with lapel collar and long sleeves. Front button closure.,RIBBED POLO Polo with lapel collar and long sleeves. Front button closure.,3,704,Shirt,Upperwear,RIBBED POLO Polo with lapel collar and long sleeves. Front button closure. Shirt
Color Duck green | 9006/177,SATIN EFFECT CUT OUT DRESS,Mini dress with V-neckline and long sleeves. Front slit with ruching and tie. Back hidden in-seam zip closure.,SATIN EFFECT CUT OUT DRESS Mini dress with V-neckline and long sleeves. Front slit with ruching and tie. Back hidden in-seam zip closure.,1,705,"Dress,short skirt",Bottomwear,"SATIN EFFECT CUT OUT DRESS Mini dress with V-neckline and long sleeves. Front slit with ruching and tie. Back hidden in-seam zip closure. Dress,short skirt"
Color Blue | 6501/799,TIE DYE SWIM SHORTS,Swim shorts with elastic waistband and adjustable front drawstring.,TIE DYE SWIM SHORTS Swim shorts with elastic waistband and adjustable front drawstring.,0,706,"casual pants,leggins,shorts",Bottomwear,"TIE DYE SWIM SHORTS Swim shorts with elastic waistband and adjustable front drawstring. casual pants,leggins,shorts"
Color Mustard | 5039/429,JACQUARD JACKET,Jacket with lapel collar and long sleeves. Contrasting rib trim. Front button closure.,JACQUARD JACKET Jacket with lapel collar and long sleeves. Contrasting rib trim. Front button closure.,10,707,"Jackets,blazers",Non-Clothing,"JACQUARD JACKET Jacket with lapel collar and long sleeves. Contrasting rib trim. Front button closure. Jackets,blazers"
Color Green/White | 8776/122,HOUNDSTOOTH TEXTURED PINAFORE DRESS,Sleeveless pinafore dress with round neck. False jewel buttons at front. Back hidden in-seam zip closure.,HOUNDSTOOTH TEXTURED PINAFORE DRESS Sleeveless pinafore dress with round neck. False jewel buttons at front. Back hidden in-seam zip closure.,1,708,"Dress,short skirt",Bottomwear,"HOUNDSTOOTH TEXTURED PINAFORE DRESS Sleeveless pinafore dress with round neck. False jewel buttons at front. Back hidden in-seam zip closure. Dress,short skirt"
Color Yellow | 5755/111,ARGYLE JACQUARD KNIT SWEATER,Round neck long sleeve sweater. Rib trim.,ARGYLE JACQUARD KNIT SWEATER Round neck long sleeve sweater. Rib trim.,7,709,"woolen articles,sweaters",Accessories,"ARGYLE JACQUARD KNIT SWEATER Round neck long sleeve sweater. Rib trim. woolen articles,sweaters"
Color Turquoise green | 4873/769,SPORTY T-SHIRT,Sleeveless athletic shirt with round neck. Front printed text.,SPORTY T-SHIRT Sleeveless athletic shirt with round neck. Front printed text.,6,710,round-neck tshirt,Accessories,SPORTY T-SHIRT Sleeveless athletic shirt with round neck. Front printed text. round-neck tshirt
Color Ecru | 5431/587,FLOCKED TEDDY BEAR SWEATSHIRT,Hooded sweatshirt with long sleeves with piped trim. Front print with flocked detail. Rib trim.,FLOCKED TEDDY BEAR SWEATSHIRT Hooded sweatshirt with long sleeves with piped trim. Front print with flocked detail. Rib trim.,6,711,round-neck tshirt,Accessories,FLOCKED TEDDY BEAR SWEATSHIRT Hooded sweatshirt with long sleeves with piped trim. Front print with flocked detail. Rib trim. round-neck tshirt
Color Blue | 4048/240,CROPPED DENIM JACKET,Cropped jacket with lapel collar and long cuffed sleeves. Front flap pockets with buttons. Washed effect. Unfinished hem. Front metal button closure.,CROPPED DENIM JACKET Cropped jacket with lapel collar and long cuffed sleeves. Front flap pockets with buttons. Washed effect. Unfinished hem. Front metal button closure.,10,712,"Jackets,blazers",Non-Clothing,"CROPPED DENIM JACKET Cropped jacket with lapel collar and long cuffed sleeves. Front flap pockets with buttons. Washed effect. Unfinished hem. Front metal button closure. Jackets,blazers"
Color Black | 4023/403,PACK OF PLAIN UNDERWEAR,Pack of two pairs of underwear with elastic waistband. Mercerized finish.,PACK OF PLAIN UNDERWEAR Pack of two pairs of underwear with elastic waistband. Mercerized finish.,11,713,accessories and combo packs,Non-Clothing,PACK OF PLAIN UNDERWEAR Pack of two pairs of underwear with elastic waistband. Mercerized finish. accessories and combo packs
Color Black | 2969/287,FAUX LEATHER DRESS,Short dress with lapel collar and long cuffed sleeves. Front patch pockets with flaps and buttons. Front metal button closure.,FAUX LEATHER DRESS Short dress with lapel collar and long cuffed sleeves. Front patch pockets with flaps and buttons. Front metal button closure.,1,714,"Dress,short skirt",Bottomwear,"FAUX LEATHER DRESS Short dress with lapel collar and long cuffed sleeves. Front patch pockets with flaps and buttons. Front metal button closure. Dress,short skirt"
Color Multicolored | 8816/190,TIE DYE WOOL BLEND OVERSHIRT,Overshirt made with wool blend fabric. Lapel collar and long sleeves. Front pockets. Front button closure.,TIE DYE WOOL BLEND OVERSHIRT Overshirt made with wool blend fabric. Lapel collar and long sleeves. Front pockets. Front button closure.,3,715,Shirt,Upperwear,TIE DYE WOOL BLEND OVERSHIRT Overshirt made with wool blend fabric. Lapel collar and long sleeves. Front pockets. Front button closure. Shirt
Color Beige | 4424/823,COMBINED DRESS WITH BUTTONS,Round neck dress with long balloon sleeves with ties. Adjustable drawstring waist.Front button closure.,COMBINED DRESS WITH BUTTONS Round neck dress with long balloon sleeves with ties. Adjustable drawstring waist.Front button closure.,1,716,"Dress,short skirt",Bottomwear,"COMBINED DRESS WITH BUTTONS Round neck dress with long balloon sleeves with ties. Adjustable drawstring waist.Front button closure. Dress,short skirt"
Color Green | 0264/559,SATIN EFFECT SHIRT WITH CONTRASTING PIPING,Satin effect shirt with lapel collar and long sleeves. Chest patch pocket. Contrasting piping detail. Front button closure.,SATIN EFFECT SHIRT WITH CONTRASTING PIPING Satin effect shirt with lapel collar and long sleeves. Chest patch pocket. Contrasting piping detail. Front button closure.,3,717,Shirt,Upperwear,SATIN EFFECT SHIRT WITH CONTRASTING PIPING Satin effect shirt with lapel collar and long sleeves. Chest patch pocket. Contrasting piping detail. Front button closure. Shirt
Color White | 0881/112,POPLIN MIDI DRESS,Straight neck dress with wide straps. Elastic smocked fabric detail. Flounced hem.,POPLIN MIDI DRESS Straight neck dress with wide straps. Elastic smocked fabric detail. Flounced hem.,1,718,"Dress,short skirt",Bottomwear,"POPLIN MIDI DRESS Straight neck dress with wide straps. Elastic smocked fabric detail. Flounced hem. Dress,short skirt"
Color Black | 1147/610,EMBOSSED ELASTIC HEELED ANKLE BOOTS,"Black heeled ankle boots. Embossed elastic upper. Thin lined heel. Pointed toe. Inner side zip closure.

AIRFIT®. Flexible technical sole made of latex foam designed to offer increased comfort.

Heel height: 3.7 inches (9.5 cm)","EMBOSSED ELASTIC HEELED ANKLE BOOTS Black heeled ankle boots. Embossed elastic upper. Thin lined heel. Pointed toe. Inner side zip closure.

AIRFIT®. Flexible technical sole made of latex foam designed to offer increased comfort.

Heel height: 3.7 inches (9.5 cm)",2,719,Footwear,Upperwear,"EMBOSSED ELASTIC HEELED ANKLE BOOTS Black heeled ankle boots. Embossed elastic upper. Thin lined heel. Pointed toe. Inner side zip closure.

AIRFIT®. Flexible technical sole made of latex foam designed to offer increased comfort.

Heel height: 3.7 inches (9.5 cm) Footwear"
Color Blue | 2211/202,FLECKED STONEWARE DESSERT PLATE,Stoneware dessert plate with a flecked finish and a blue rim.,FLECKED STONEWARE DESSERT PLATE Stoneware dessert plate with a flecked finish and a blue rim.,4,720,non-clothing stuff,Accessories,FLECKED STONEWARE DESSERT PLATE Stoneware dessert plate with a flecked finish and a blue rim. non-clothing stuff
Color Silver | 6215/830,METALLIC HIGH TOPS,"High-top sneakers with metallic effect. Adjustable laces and side zip closure. Back pull tab for ease. Interior lining and insole in 100% cotton. Contrasting rubber soles.

STARFIT®-Flexible technical sole made of polyurethane foam designed to offer increased comfort.","METALLIC HIGH TOPS High-top sneakers with metallic effect. Adjustable laces and side zip closure. Back pull tab for ease. Interior lining and insole in 100% cotton. Contrasting rubber soles.

STARFIT®-Flexible technical sole made of polyurethane foam designed to offer increased comfort.",2,721,Footwear,Upperwear,"METALLIC HIGH TOPS High-top sneakers with metallic effect. Adjustable laces and side zip closure. Back pull tab for ease. Interior lining and insole in 100% cotton. Contrasting rubber soles.

STARFIT®-Flexible technical sole made of polyurethane foam designed to offer increased comfort. Footwear"
Color Black | 7385/700,FLARED PANTS,Flared pants with elastic waistband. False front pockets. Back pleat detail.,FLARED PANTS Flared pants with elastic waistband. False front pockets. Back pleat detail.,0,722,"casual pants,leggins,shorts",Bottomwear,"FLARED PANTS Flared pants with elastic waistband. False front pockets. Back pleat detail. casual pants,leggins,shorts"
Color Sky blue | 9367/422,BUTTONED SATIN EFFECT BLOUSE,High collar blouse with V-neckline and long sleeves with cuffs with metal buttons. Back closure with opening and self-tie.,BUTTONED SATIN EFFECT BLOUSE High collar blouse with V-neckline and long sleeves with cuffs with metal buttons. Back closure with opening and self-tie.,5,723,"top,blouse,jumpsuit",Accessories,"BUTTONED SATIN EFFECT BLOUSE High collar blouse with V-neckline and long sleeves with cuffs with metal buttons. Back closure with opening and self-tie. top,blouse,jumpsuit"
Color taupe brown | 5536/700,WIDE RIBBED KNIT SWEATER,Knit sweater with round neck and long sleeves.,WIDE RIBBED KNIT SWEATER Knit sweater with round neck and long sleeves.,7,724,"woolen articles,sweaters",Accessories,"WIDE RIBBED KNIT SWEATER Knit sweater with round neck and long sleeves. woolen articles,sweaters"
Color Mauve | 2658/710,SWISS DOT DRESS,Round neck dress with long sleeves with elastic cuffs. Buttoned back teardrop closure. Elasticized detail.,SWISS DOT DRESS Round neck dress with long sleeves with elastic cuffs. Buttoned back teardrop closure. Elasticized detail.,1,725,"Dress,short skirt",Bottomwear,"SWISS DOT DRESS Round neck dress with long sleeves with elastic cuffs. Buttoned back teardrop closure. Elasticized detail. Dress,short skirt"
Color Multicolored | 9878/168,FLORAL PRINT DRESS,V-neck dress with short sleeves. Smocked elastic waist. Flounced hem.,FLORAL PRINT DRESS V-neck dress with short sleeves. Smocked elastic waist. Flounced hem.,1,726,"Dress,short skirt",Bottomwear,"FLORAL PRINT DRESS V-neck dress with short sleeves. Smocked elastic waist. Flounced hem. Dress,short skirt"
Color Khaki | 5536/166,RIBBED KNIT TOP,Sleeveless high collar top.,RIBBED KNIT TOP Sleeveless high collar top.,5,727,"top,blouse,jumpsuit",Accessories,"RIBBED KNIT TOP Sleeveless high collar top. top,blouse,jumpsuit"
Color Mid-green | 8672/338,SATIN EFFECT WRAP DRESS,Short dress with lapel collar and V-neck wrap front with long sleeves. Side draped fabric detail with lined buttons. Interior lining. Hidden in-seam side zip closure.,SATIN EFFECT WRAP DRESS Short dress with lapel collar and V-neck wrap front with long sleeves. Side draped fabric detail with lined buttons. Interior lining. Hidden in-seam side zip closure.,1,728,"Dress,short skirt",Bottomwear,"SATIN EFFECT WRAP DRESS Short dress with lapel collar and V-neck wrap front with long sleeves. Side draped fabric detail with lined buttons. Interior lining. Hidden in-seam side zip closure. Dress,short skirt"
Color Black | 3920/318,TECHNICAL CAP,Cap made of a combination of breathable technical fabrics. Elastic fit to ensure fit and adaptability.,TECHNICAL CAP Cap made of a combination of breathable technical fabrics. Elastic fit to ensure fit and adaptability.,7,729,"woolen articles,sweaters",Accessories,"TECHNICAL CAP Cap made of a combination of breathable technical fabrics. Elastic fit to ensure fit and adaptability. woolen articles,sweaters"
Color Black | 1608/231,PANTS WITH BUCKLE BELT,High waisted pants with pronounced seams. Belt with metal buckle. Back hidden zip closure.,PANTS WITH BUCKLE BELT High waisted pants with pronounced seams. Belt with metal buckle. Back hidden zip closure.,0,730,"casual pants,leggins,shorts",Bottomwear,"PANTS WITH BUCKLE BELT High waisted pants with pronounced seams. Belt with metal buckle. Back hidden zip closure. casual pants,leggins,shorts"
Color Pink / White | 8292/382,CROPPED PRINTED PANTS,High-waisted pants with front pockets. Front zip and metal hook closure.,CROPPED PRINTED PANTS High-waisted pants with front pockets. Front zip and metal hook closure.,0,731,"casual pants,leggins,shorts",Bottomwear,"CROPPED PRINTED PANTS High-waisted pants with front pockets. Front zip and metal hook closure. casual pants,leggins,shorts"
Color Neon pink | 3528/816,FLOWY STRAIGHT CUT BLAZER,Flowy lapel collar blazer with long sleeves. Front flap pockets and welt pocket at chest. Tonal matching inner lining. Back vent. Front button closure.,FLOWY STRAIGHT CUT BLAZER Flowy lapel collar blazer with long sleeves. Front flap pockets and welt pocket at chest. Tonal matching inner lining. Back vent. Front button closure.,10,732,"Jackets,blazers",Non-Clothing,"FLOWY STRAIGHT CUT BLAZER Flowy lapel collar blazer with long sleeves. Front flap pockets and welt pocket at chest. Tonal matching inner lining. Back vent. Front button closure. Jackets,blazers"
Color Clay | 4805/610,PLAIN PLUSH JUMPSUIT,Straight neck plush jumpsuit with straps. Front button closure with placket. Front pockets.,PLAIN PLUSH JUMPSUIT Straight neck plush jumpsuit with straps. Front button closure with placket. Front pockets.,5,733,"top,blouse,jumpsuit",Accessories,"PLAIN PLUSH JUMPSUIT Straight neck plush jumpsuit with straps. Front button closure with placket. Front pockets. top,blouse,jumpsuit"
Color Stone | 2364/555,STONE DOOR KNOB (PACK OF 2),Round stone door knob. Sold in packs of 2.,STONE DOOR KNOB (PACK OF 2) Round stone door knob. Sold in packs of 2.,4,734,non-clothing stuff,Accessories,STONE DOOR KNOB (PACK OF 2) Round stone door knob. Sold in packs of 2. non-clothing stuff
Color Ecru / Blue | 7888/153,PRINTED LONG CAFTAN,V-neck caftan with wide elbow-length sleeves. Front tie wrap closure.,PRINTED LONG CAFTAN V-neck caftan with wide elbow-length sleeves. Front tie wrap closure.,1,735,"Dress,short skirt",Bottomwear,"PRINTED LONG CAFTAN V-neck caftan with wide elbow-length sleeves. Front tie wrap closure. Dress,short skirt"
Color Black | 3914/820,MULTI-POCKET PHONE CASE,"Cell phone case. Made of fabric. Soft construction. Available in different colors. Adjustable strap to wear the case from the neck. The strap has three small zip pockets.

Height x Length x Width 6.9 x 4.5 x 1.4 inches (17.5 x 11.5 x 3.5 cm) 

Strap dimensions (Length x Width): 45.3 x 3 inches (115 x 7.5 cm)","MULTI-POCKET PHONE CASE Cell phone case. Made of fabric. Soft construction. Available in different colors. Adjustable strap to wear the case from the neck. The strap has three small zip pockets.

Height x Length x Width 6.9 x 4.5 x 1.4 inches (17.5 x 11.5 x 3.5 cm) 

Strap dimensions (Length x Width): 45.3 x 3 inches (115 x 7.5 cm)",9,736,bags,Non-Clothing,"MULTI-POCKET PHONE CASE Cell phone case. Made of fabric. Soft construction. Available in different colors. Adjustable strap to wear the case from the neck. The strap has three small zip pockets.

Height x Length x Width 6.9 x 4.5 x 1.4 inches (17.5 x 11.5 x 3.5 cm) 

Strap dimensions (Length x Width): 45.3 x 3 inches (115 x 7.5 cm) bags"
Color White | 2575/105,LACQUERED SOAP DISH,Rectangular acacia wood soap dish with a white lacquered top.,LACQUERED SOAP DISH Rectangular acacia wood soap dish with a white lacquered top.,4,737,non-clothing stuff,Accessories,LACQUERED SOAP DISH Rectangular acacia wood soap dish with a white lacquered top. non-clothing stuff
Color Electric blue | 8246/250,ZW THE SKINNY FLARE JEANS,"Slim Fit - Skinny Flare Leg - Mid Rise
ZW SIGNATURE DENIM JEANS

Mid-rise jeans with five pockets. Washed effect. Flared legs. Front zip and metal button closure.","ZW THE SKINNY FLARE JEANS Slim Fit - Skinny Flare Leg - Mid Rise
ZW SIGNATURE DENIM JEANS

Mid-rise jeans with five pockets. Washed effect. Flared legs. Front zip and metal button closure.",12,738,Jeans,Non-Clothing,"ZW THE SKINNY FLARE JEANS Slim Fit - Skinny Flare Leg - Mid Rise
ZW SIGNATURE DENIM JEANS

Mid-rise jeans with five pockets. Washed effect. Flared legs. Front zip and metal button closure. Jeans"
Color Indigo | 0706/340,PLAID JACQUARD JACKET,Lapel collar jacket with long sleeves with buttoned cuffs. Patch pockets at hip. Front button closure.,PLAID JACQUARD JACKET Lapel collar jacket with long sleeves with buttoned cuffs. Patch pockets at hip. Front button closure.,10,739,"Jackets,blazers",Non-Clothing,"PLAID JACQUARD JACKET Lapel collar jacket with long sleeves with buttoned cuffs. Patch pockets at hip. Front button closure. Jackets,blazers"
Color Ecru | 5290/200,EARTHENWARE DINNER PLATE WITH A RAISED-DESIGN EDGE,Ecru earthenware dinner plate. Solid with decorative raised design on the edge.,EARTHENWARE DINNER PLATE WITH A RAISED-DESIGN EDGE Ecru earthenware dinner plate. Solid with decorative raised design on the edge.,4,740,non-clothing stuff,Accessories,EARTHENWARE DINNER PLATE WITH A RAISED-DESIGN EDGE Ecru earthenware dinner plate. Solid with decorative raised design on the edge. non-clothing stuff
Color taupe brown | 0653/291,KNIT BEANIE,Knit beanie.,KNIT BEANIE Knit beanie.,7,741,"woolen articles,sweaters",Accessories,"KNIT BEANIE Knit beanie. woolen articles,sweaters"
Color Navy blue | 4440/331,PLAID SUIT PANTS,Slim fit pants. Front pockets and back welt pockets. Front zip and button closure.,PLAID SUIT PANTS Slim fit pants. Front pockets and back welt pockets. Front zip and button closure.,0,742,"casual pants,leggins,shorts",Bottomwear,"PLAID SUIT PANTS Slim fit pants. Front pockets and back welt pockets. Front zip and button closure. casual pants,leggins,shorts"
Color Black | 4805/300,PRINTED KNIT T-SHIRT,Knit T-shirt made of spun cotton fabric. Round neck and short sleeves.,PRINTED KNIT T-SHIRT Knit T-shirt made of spun cotton fabric. Round neck and short sleeves.,6,743,round-neck tshirt,Accessories,PRINTED KNIT T-SHIRT Knit T-shirt made of spun cotton fabric. Round neck and short sleeves. round-neck tshirt
Color Mid-blue | 4743/700,MEDIUM WASH DENIM OVERSHIRT,Denim overshirt with lapel collar and long sleeves. Front button closure and button closure flap patch pockets at chest.,MEDIUM WASH DENIM OVERSHIRT Denim overshirt with lapel collar and long sleeves. Front button closure and button closure flap patch pockets at chest.,3,744,Shirt,Upperwear,MEDIUM WASH DENIM OVERSHIRT Denim overshirt with lapel collar and long sleeves. Front button closure and button closure flap patch pockets at chest. Shirt
Color White | 4359/040,MEDIUM ALABASTER TRAY,Round alabaster stone tray. Ideal for completing any type of decoration.,MEDIUM ALABASTER TRAY Round alabaster stone tray. Ideal for completing any type of decoration.,4,745,non-clothing stuff,Accessories,MEDIUM ALABASTER TRAY Round alabaster stone tray. Ideal for completing any type of decoration. non-clothing stuff
Color Sky blue | 5710/547,OVERSIZED SHIRT,Full cut shirt with Italian collar and long sleeves with buttoned cuffs. Front button closure.,OVERSIZED SHIRT Full cut shirt with Italian collar and long sleeves with buttoned cuffs. Front button closure.,3,746,Shirt,Upperwear,OVERSIZED SHIRT Full cut shirt with Italian collar and long sleeves with buttoned cuffs. Front button closure. Shirt
Color Ecru | 8085/867,CHECKERED COTTON PANTS,Pants made of 100% cotton. High-waisted with elastic waistband. Hidden in-seam side pockets. Wide leg.,CHECKERED COTTON PANTS Pants made of 100% cotton. High-waisted with elastic waistband. Hidden in-seam side pockets. Wide leg.,0,747,"casual pants,leggins,shorts",Bottomwear,"CHECKERED COTTON PANTS Pants made of 100% cotton. High-waisted with elastic waistband. Hidden in-seam side pockets. Wide leg. casual pants,leggins,shorts"
Color White | 4529/374,FLORAL PRINT SHIRT,Regular fit shirt with lapel collar and short sleeves. Front button closure.,FLORAL PRINT SHIRT Regular fit shirt with lapel collar and short sleeves. Front button closure.,3,748,Shirt,Upperwear,FLORAL PRINT SHIRT Regular fit shirt with lapel collar and short sleeves. Front button closure. Shirt
